<?xml version="1.0"?>
<?xml-stylesheet type="text/xsl" href="people.xsl"?>
<!DOCTYPE people SYSTEM "people.dtd">

<people>
<person>
	<name>Ian Darwin</name>
	<email>http://www.darwinsys.com/</email>
	<country>Canada</country>
</person>
<person>
	<name>Another Darwin</name>
	<email type="intranet">ad</email>
	<country>Canada</country>
</person>
</people>
